{
  "id": "offer-blueberry-10",
  "name": "Blueberry Funded — 20% Off Assessment Fees",
  "propFirmIds": ["d0000003-0000-0000-0000-000000000003"],
  "trackingUrl": "https://blueberryfunded.com/?utm_source=affiliate&ref=1457",
  "terms": "20% discount on all assessment fees. Enter code PROPFIRMS20 at checkout.",
  "startAt": "2026-02-01",
  "endAt": "2026-12-31"
}
