{
  "id": "offer-cti",
  "name": "City Traders Imperium — Affiliate Link",
  "propFirmIds": ["d0000031-0000-0000-0000-000000000031"],
  "trackingUrl": "https://app.citytradersimperium.com/register?referral_code=a3c20b&utm_source=client&utm_medium=referral",
  "terms": "Sign up via our referral link."
}
