{
  "id": "offer-fundednext-futures-pf",
  "name": "FundedNext Futures — 30% Off Futures Challenges",
  "propFirmIds": ["d0000007-0000-0000-0000-000000000007"],
  "trackingUrl": "https://fundednext.com/futures?ref=bestpropfirms",
  "terms": "Use promo code PF at checkout for 30% off all FundedNext Futures challenges. Limited time offer.",
  "startAt": "2026-02-01",
  "endAt": "2026-07-07"
}
