{
  "id": "offer-topstep",
  "name": "Topstep — Affiliate Link",
  "propFirmIds": ["d0000010-0000-0000-0000-000000000010"],
  "trackingUrl": "https://products.topstep.com/?utm_source=homepage&utm_medium=cta&utm_campaign=cms_ctas&utm_content=earn_funding",
  "terms": "Sign up via our referral link."
}
