{
  "id": "offer-apex-90",
  "name": "Apex Trader Funding — 90% Off All Accounts",
  "propFirmIds": ["d0000020-0000-0000-0000-000000000020"],
  "trackingUrl": "https://apextraderfunding.com/",
  "terms": "90% discount on all Apex Trader Funding accounts. Limited time promotion — enter code at checkout.",
  "startAt": "2026-02-01",
  "endAt": "2026-02-28"
}
