{
  "id": "offer-dna-funded-25",
  "name": "DNA Funded — 25% Off All Challenges",
  "propFirmIds": ["d0000001-0000-0000-0000-000000000001"],
  "trackingUrl": "https://partners.dnafunded.com/click?campaign_id=1&ref_id=30",
  "terms": "25% discount on all challenge account sizes. Applied automatically at checkout with code.",
  "startAt": "2026-02-01",
  "endAt": "2026-03-31"
}
