{
  "id": "offer-alpha-capital-10kfor40",
  "name": "Alpha Capital — $10K Account for $40",
  "propFirmIds": ["d0000024-0000-0000-0000-000000000024"],
  "trackingUrl": "https://alphacapitalgroup.uk/?ref=bestpropfirms",
  "terms": "Use code 10KFOR40 at checkout to get a $10,000 account for just $40.",
  "startAt": "2026-02-24",
  "endAt": "2026-12-31"
}
