{
  "id": "offer-alpha-capital-ondemand",
  "name": "Alpha Capital — 25% Off On-Demand Payout + 90% Performance Fee",
  "propFirmIds": ["d0000024-0000-0000-0000-000000000024"],
  "trackingUrl": "https://alphacapitalgroup.uk/?ref=bestpropfirms",
  "terms": "Use code ONDEMAND at checkout for 25% off the On-Demand Payout option plus 90% performance fee.",
  "startAt": "2026-02-24",
  "endAt": "2026-12-31"
}
