{
  "id": "offer-brightfunded-20",
  "name": "BrightFunded — 20% Off All Challenges",
  "propFirmIds": ["d0000002-0000-0000-0000-000000000002"],
  "trackingUrl": "https://brightfunded.com/?ref=bestpropfirms",
  "terms": "20% discount on all challenge account sizes. Enter code PROPFIRMS20 at checkout.",
  "startAt": "2026-02-01",
  "endAt": "2026-12-31"
}
