{
  "id": "offer-alpha-capital-15",
  "name": "Alpha Capital — 15% Off All Accounts",
  "propFirmIds": ["d0000024-0000-0000-0000-000000000024"],
  "trackingUrl": "https://alphacapitalgroup.uk/?ref=bestpropfirms",
  "terms": "Use code ALPHA15 at checkout for 15% discount on all challenge account sizes.",
  "startAt": "2026-02-24",
  "endAt": "2026-12-31"
}
